{
  "entry_id": "2026-08-24-lifeos-ai-project-start",
  "date": "2026-08-24",
  "title": "LifeOS AI 项目启动",
  "source": {
    "type": "transcript",
    "reference": "examples/sample-transcript.md",
    "language": "zh-CN",
    "privacy_level": "limited"
  },
  "tags": ["LifeOS", "AI产品", "视频日记", "项目启动"],
  "related_projects": ["LifeOS AI"],
  "summary": [
    "今天围绕 LifeOS AI 的视频日记智能体完成了项目初始化。",
    "项目当前优先沉淀产品定义、Agent 分工和手工处理流程。",
    "短期目标是先跑通从视频日记到结构化日记的 v0.2 手工原型。"
  ],
  "events": [
    {
      "title": "创建项目文档骨架",
      "description": "建立 README、产品文档、Agent Prompt、路线图和架构决策记录。",
      "time_hint": "today",
      "related_people": [],
      "related_projects": ["LifeOS AI"]
    },
    {
      "title": "决定暂时本地推进",
      "description": "由于云端写入权限暂未打通，项目先在本地仓库继续迭代。",
      "time_hint": "today",
      "related_people": [],
      "related_projects": ["LifeOS AI"]
    }
  ],
  "people": [],
  "emotions": [
    {
      "label": "推进感",
      "intensity": 4,
      "evidence": "项目目录和第一批文档已经落地，可以进入下一阶段。"
    }
  ],
  "insights": [
    "先用手工工作流验证价值，比直接开发完整应用更稳妥。",
    "视频日记智能体的关键不是转写本身，而是长期记忆和反思质量。"
  ],
  "cognitive_challenge": {
    "possible_patterns": [
      "可能过早扩大系统边界，需要先聚焦单条日记处理闭环。"
    ],
    "reflection_questions": [
      "第一条真实视频日记应该选择什么场景来验证价值？",
      "哪些输出会让用户愿意第二天继续记录？"
    ],
    "small_experiments": [
      "用一段 3 到 5 分钟的视频或文本日记跑完整手工流程。"
    ]
  },
  "action_items": [
    {
      "action": "准备第一条真实或模拟视频日记转写文本",
      "owner": "user",
      "due_date": "",
      "status": "todo"
    }
  ],
  "memory_candidates": [
    {
      "type": "project",
      "content": "LifeOS AI 的第一阶段聚焦视频日记智能体。",
      "confidence": "high",
      "review_required": false,
      "source_quote": "当前第一阶段聚焦视频日记智能体"
    }
  ],
  "content_candidates": [
    {
      "format": "article",
      "core_idea": "为什么个人 AI 系统可以从视频日记开始",
      "draft_reference": "",
      "privacy_review_required": true
    }
  ]
}

